entity,question_code,description
PopulationDensity2010,PDEN10,Population density based on 2010 Census data.
CensusData,PDEN10,Data collected from the 2010 Census.
CoreBasedStatisticalArea,PDEN10,Geographical area classification provided by the Office of Management and Budget (OMB) in December 2009.
OfficeOfManagementAndBudget,PDEN10,Office that provides Core Based Statistical Area classifications.
CountyMetroNonMetroStatus,COUTYP4,The metro or non-metro status of the county based on the 2013 Rural/Urban Continuum Codes.
RuralUrbanContinuumCodes,,Classification scheme that distinguishes metropolitan counties by the population size of their metro area and non-metropolitan counties by degree of urbanization and adjacency to a metro area.
American Indian Areas (AIAs),MAIIN102,The Census provides data for five types of American Indian areas (AIAs).
Federally-recognized American Indian reservations (AIRs),MAIIN102,Areas set aside by the U.S. for the use of American Indian tribes with primary governmental authority.
State-recognized American Indian Reservations (SAIRs),MAIIN102,Reservations established by State governments for state-recognized tribes with possible governmental authority.
Oklahoma tribal statistical areas (OTSAs),MAIIN102,Areas representing former American Indian reservations in Oklahoma prior to statehood in 1907.
Tribal designated statistical areas (TDSAs),MAIIN102,Areas identified for federally-recognized tribes without AIR or off-reservation trust land.
State designated tribal statistical areas (SDTSAs),MAIIN102,Areas identified for State-recognized tribes without federal recognition or AIR.
Joint-use area,MAIIN102,An area defined by the Census Bureau where more than one tribe claims jurisdiction.
Majority AIA Variable,MAIIN102,A variable created by summing dwelling units in each AIA within the segment to assign the AIA with the most dwelling units.
American Indian Area,AIIND102,"Area types recognized by the Census for American Indian populations including AIRs, SAIRs, OTSAs, TDSAs, and SDTSAs."
Federally-recognized American Indian Reservation (AIR),AIIND102,Reservations and off-reservation trust lands recognized by the federal government with tribes having primary governmental authority.
State-recognized American Indian Reservation (SAIR),AIIND102,Reservations established by state governments for tribes recognized by the state.
Oklahoma Tribal Statistical Area (OTSA),AIIND102,Areas representing former reservations in Indian and Oklahoma territories before statehood in 1907.
Tribal Designated Statistical Area (TDSA),AIIND102,"Areas for federally-recognized tribes without a reservation, intended to encompass areas with a concentration of tribal members."
State Designated Tribal Statistical Area (SDTSA),AIIND102,"Areas for state-recognized tribes without a reservation, intended to encompass areas with a concentration of tribal members."
Age,AGE3,"The final edited age of the respondent, considering multiple opportunities to change their age during the survey."
Birthdate,AGE3,The birthdate entered by the respondent at the beginning of the questionnaire.
RawBirthdate,AGE3,The age calculated from the raw birthdate.
InterviewDate,AGE3,The final edited interview date used to determine the final age.
QuestionnaireRosterAge,AGE3,"The age entered in the questionnaire roster, if it exists."
PreInterviewScreenerAge,AGE3,The age recorded in the pre-interview screener.
Number_of_Times_Married,NOMARR2,The number of times the respondent has been married.
Respondent,NOMARR2,The individual who is responding to the survey question about their marital history.
Service,SERVICE,Have you ever been in the United States Armed Forces?
US Armed Forces,SERVICE,United States Armed Forces
MilitaryStatus,MILSTAT,Current military status of the respondent in the United States Armed Forces.
ActiveDutyStatus,MILSTAT,Respondent is currently on active duty in the United States Armed Forces.
ReserveComponentStatus,MILSTAT,Respondent is currently in a Reserve component of the United States Armed Forces.
SeparatedOrRetiredStatus,MILSTAT,Respondent is now separated or retired from the United States Armed Forces.
ActiveDuty,,Serving on active duty in the United States Armed Forces or Reserve components.
USMilitary,,"The United States Armed Forces, including Reserve components."
Activation,,Get activated for duty during national emergency or military conflict.
NationalEmergency,,Situations requiring the activation of military personnel.
MilitaryConflict,,Conflicts requiring military engagement.
Respondent,,Individual answering the survey.
ActiveDutyPeriod,ACTD9001,The period when the respondent served active duty in the United States Armed Forces or Reserve components
PersianGulfWar,ACTD9001,A specific conflict period included in the active duty response options: Persian Gulf War.
SurveyRespondent,ACTD9001,Individual responding to the survey question.
MilitaryService,ACTD9001,Service in the United States Armed Forces or Reserve components.
ActiveDutyPeriod,ACTD7590,Period when the respondent served on active duty in the United States Armed Forces or Reserve components.
ServiceInUSArmedForces,ACTD7590,Respondent's service in the United States Armed Forces or Reserve components.
MilitaryServicePeriod,ACTDVIET,"Time period of active duty service in the United States Armed Forces or Reserve components, specifically from March 1961 to April 1975."
VietnamEra,ACTDVIET,The specific era of the Vietnam War from March 1961 to April 1975.
Respondent,ACTDVIET,The individual providing information about their military service.
ActiveDutyService,ACTDPRIV,Service on active duty in the United States Armed Forces or Reserve components before the Vietnam era (March 1961).
TimePeriod,ACTDPRIV,Any time before the Vietnam era (March 1961).
RespondentServicePeriod,ACTDPRIV,The service period of the respondent in the United States Armed Forces or Reserve components.
MilitaryService,COMBATPY,Service in the United States Armed Forces or Reserve components.
MilitaryCombatZone,COMBATPY,Combat zone where the respondent served.
ImminentDangerPay,COMBATPY,Special pay received by the respondent for serving in areas of imminent danger.
HostileFirePay,COMBATPY,Special pay received by the respondent for facing hostile fire.
ActiveDuty,COMBATPY,Active duty service in the military.
OverallHealth,HEALTH,Respondent's self-assessment of their overall health.
HealthStatus,HEALTH,The general health status of the respondent ranging from excellent to poor.
Individual,HEALTH,A respondent who is part of the survey.
NumberOfTimesMoved,MOVSINPYR2,The number of times a respondent has moved in the past 12 months.
TimePeriod,MOVSINPYR2,The past 12 months.
Move,MOVSINPYR2,A change in residence from one location to another.
Location,MOVSINPYR2,"A specific city, town, or residence."
Sexual Attraction,SEXATRACT,Level or type of sexual attraction to other people.
Person,SEXATRACT,Individual respondent who provides their feelings on sexual attraction.
SexualIdentity,SEXIDENT,The sexual identity of the respondent as self-identified in the survey.
Respondent,SEXIDENT,An individual participating in the NSDUH survey.
English Proficiency,SPEAKENGL,Respondent's ability to speak English
Respondent,SPEAKENGL,The individual participating in the survey
DifficultySeeing,LVLDIFSEE2,Measures the difficulty in seeing even when wearing glasses or contact lenses.
VisionImpairment,LVLDIFSEE2,"A condition related to the difficulty in seeing, despite the use of corrective lenses."
Respondent,LVLDIFSEE2,The person answering the survey question.
HearingDifficulty,LVLDIFHEAR2,Level of difficulty hearing even with hearing aids
WalkingDifficulty,LVLDIFWALK2,Level of difficulty in walking or climbing steps experienced by the respondent.
DifficultyRememberingOrConcentrating,LVLDIFMEM2,Level of difficulty remembering or concentrating
MentalHealthIssue,LVLDIFMEM2,Aspect of mental health related to memory and concentration difficulties
Self-Care Difficulty,LVLDIFCARE2,"Level of difficulty with self-care tasks, such as washing all over or dressing."
Self-Care Tasks,LVLDIFCARE2,Tasks related to personal hygiene and dressing.
Respondent,LVLDIFCARE2,"Individual aged 12 or older in the civilian, noninstitutionalized U.S. population answering the survey."
DifficultyCommunicating,LVLDIFCOMM2,Difficulty in communicating using one's usual language.
UsualLanguage,LVLDIFCOMM2,The language usually spoken by the respondent.
Gender,IRSEX,Gender of the respondent.
Survey,IRSEX,National Survey on Drug Use and Health (NSDUH) survey.
MaritalStatus,IRMARIT,Imputation revised marital status of the respondent.
SurveyPeriod,IRMARIT,Time period when the survey question was administered (2015 vs. 2016 and other prior years).
SurveyAdministrationMethod,IRMARIT,The method of administering the marital status question (Self-administration in 2015 vs. Interviewer administration in 2016 and other prior years).
Marital Status,IIMARIT,Indicates the marital status of the respondent.
Imputation Indicator,IIMARIT,Reflects whether the marital status question was self-administered or interviewer-administered.
Survey,IIMARIT,"The survey which includes questions on various topics, such as marital status."
Survey Year,IIMARIT,The year in which the survey was conducted.
EDUCATION,IREDUHIGHST2,EDUCATION - RECODED IMPUTATION REVISED
VARIABLE,IREDUHIGHST2,The variable reflects the move of the marital status questions from self-administration in 2015 back to interviewer administration in 2016.
MARITAL_STATUS,IREDUHIGHST2,"The status of being married, single, divorced, etc."
SURVEY_PERIOD,IREDUHIGHST2,The time frame during which the survey data was collected.
ANALYTIC_GOALS,IREDUHIGHST2,The aims or objectives that should be considered when analyzing the data.
EDUCATION,IIEDUHIGHST2,Indicator of education - imputation indicator.
MARITAL_STATUS,IIEDUHIGHST2,Marital status question administration method and its comparability over years.
AgeCategory,CATAGE,Respondent's age category.
MaritalStatus,CATAGE,Marital status of the respondent.
SurveyPeriod,CATAGE,"Year of the survey (2002 to 2016, excluding 2015) the data is collected in."
AgeCategory,CATAG2,Age category recode with 3 levels.
MaritalStatus,CATAG2,Marital status information related to the respondent.
SurveyYear,CATAG2,Year in which the survey is conducted.
AgeCategoryRecode,CATAG3,Recoded age categories into five levels for analysis purposes.
MaritalStatus,CATAG3,"The marital status of the respondent, noting the method of administration changing over the years, affecting comparability of data."
SurveyYear,CATAG3,"The year in which the survey was administered, noting changes in the survey method affecting comparability."
RC-AGE CATEGORY,CATAG6,Categorized age of the respondent (6 levels).
Marital Status,CATAG6,"Marital status of the respondent, affected by the shift from self-administration to interviewer administration after 2015."
AgeCategory,CATAG7,Age category recoded into 7 levels.
MaritalStatus,,Marital status of the respondent.
SurveyYear,,Year in which the survey data was collected.
AdministrationMode,,Mode of administration for the survey questions (self-administration or interviewer-administered).
PregnancyAgeCategoryRecode,PREGAGE2,Categorization of respondent's age at pregnancy.
Respondent,PREGAGE2,An individual who participates in the survey.
MaritalStatusQuestion,PREGAGE2,Question related to the marital status of the respondent.
SurveyPeriod2015,PREGAGE2,Survey period in the year 2015.
SurveyPeriod2002to2014,PREGAGE2,Survey period from the years 2002 to 2014.
SurveyPeriod2016,PREGAGE2,Survey period in the year 2016.
Variable,,Age category in relation to DUI (Driving Under the Influence). Reflects changes in administration method for marital status questions in the survey.
MaritalStatus,,The marital status of the respondent; note the changes in survey administration method over different years.
SurveyAdministrationMethod,,Indicates whether marital status questions were self-administered or interviewer-administered.
Question,DRVINDETAG,RC-DUI DETAILED AGE CATEGORY RECODE
Variable,,Detailed age category recode for DUI incidents
Marital Status,,Comparison of marital status data across different years
Time Period,,The year in which the survey data was collected
Gender,SEXAGE,Respondent's gender
Age,SEXAGE,Respondent's age category
RaceHispanicityRecode,NEWRACE2,RC-RACE/HISPANICITY RECODE (7 LEVELS)
MaritalStatus,NEWRACE2,Marital status as determined by different methodologies in various years of the survey.
Gender,SEXRACE,Represents the gender of the respondent.
Race,SEXRACE,Represents the race of the respondent.
Marital Status,SEXRACE,Indicates the marital status of the respondent.
Survey Period,SEXRACE,Time period of the survey reference.
EducationCategory,,Categories of educational attainment.
MaritalStatusComparability,,"Indicates changes in how marital status questions were administered between self-administration and interviewer administration in certain years, affecting comparability."
OverallHealthIndicator,HEALTH2,RC-OVERALL HEALTH RECODE
SurveyMethod,HEALTH2,Mode of administration for marital status questions (self-administration or interviewer administration)
MaritalStatusVariable,HEALTH2,Reflects marital status variable and its comparability over the years
SurveyYear,HEALTH2,"Years of data collection for marital status variable comparability (2002-2014, 2015, 2016)"
SchoolEnrollmentStatus,EDUSCHLGO,"Current enrollment status in school, including breaks with intention to return."
SchoolType,EDUSCHLGO,"Types of schools mentioned include elementary school, junior high or middle school, high school, college, university, and home schooling."
SurveyRespondent,EDUSCHLGO,The person who is responding to the survey.
Education,EDUSCHGRD2,The grade or year of school the respondent is currently attending or will be attending after their vacation.
GradeLevel,EDUSCHGRD2,The specific grade level or academic year the respondent is in or will enter.
Respondent,EDUSCHGRD2,The individual answering the question about their current or upcoming grade or year of school.
StudentStatus,,Indicates whether the respondent is a full-time or part-time student.
Respondent,,The individual responding to the survey question.
DaysMissedSchool,EDUSCKEST,Number of whole days missed from school because of being sick or injured.
Reason,EDUSCKEST,Reasons for missing school - could be sickness or injury.
SurveyPeriod,EDUSCKEST,"The time period during which the behavior is reported, in this case, the past 30 days."
SchoolAbsenteeism,EDUSCKCOM,Number of days missed school due to being sick (combined)
SchoolAbsenteeismMonth,EDUSCKMON,Number of days missed school in the month due to being sick (given a valid number)
SchoolAbsenteeismEstimate,EDUSCKEST,Estimated number of days missed school due to being sick when respondents answered 'don't know' or 'refused'
Respondent,EDUSCKCOM,The individual providing responses to the survey questions
SurveyQuestion,EDUSCKCOM,A specific question within the NSDUH survey
SchoolAttendance,EDUSKPMON,"The frequency of whole days missed from school due to skipping, cutting, or not wanting to be there in the past 30 days."
DateRange,EDUSKPMON,The past 30-day period referred to in the question.
PersonalReason,EDUSKPMON,"Personal reasons like skipping, cutting, or not wanting to attend school as reasons for missing school days."
SchoolAttendance,EDUSKPEST,Number of whole days of school missed because of skipping or 'cutting'.
SurveyPeriod,EDUSKPEST,"The period during which the survey is concerned, specifically the past 30 days."
Respondent,EDUSKPEST,The individual providing the response about school attendance.
SchoolDaysMissed,,"Number of days missed school from skipping, based on responses from EDUSKPMON and EDUSKPEST."
Respondent,,Individual responding to the survey.
SchoolAttendance,,"Attendance record of the respondent, including days missed from school."
ImmediateFamily,MILTFAMLY,"Pool of family members considered for the question whether any are currently serving in the US military. This includes spouse, unmarried partner, mother, father, sons, daughters, brothers, and sisters, whether biological, step or adoptive."
MilitaryStatus,MILTFAMLY,Indicates whether any of the immediate family members are currently serving in the United States military.
FamilyMember,MILTFAMLY,"Members of the respondent's family including spouse, unmarried partner, mother, father, sons, daughters, brothers, and sisters who are considered when answering the military service question."
MilitaryStatus,MILTSPPAR,"Current military status of spouse, partner, or other family members."
FamilyMember,MILTSPPAR,"Specific family members considered in the survey question: spouse, unmarried partner, mother, father, son(s), daughter(s), brother(s), sister(s)."
Spouse,MILTSPPAR,"Spouse of the respondent, regardless of biological, step, or adoptive status."
UnmarriedPartner,MILTSPPAR,Unmarried partner of the respondent.
Parent,MILTSPPAR,"Mother or father of the respondent, inclusive of biological, step, or adoptive."
Child,MILTSPPAR,"Son(s) or daughter(s) of the respondent, inclusive of biological, step, or adoptive."
Sibling,MILTSPPAR,"Brother(s) or sister(s) of the respondent, inclusive of biological, step, or adoptive."
MilitaryService,MILTSPPAR,Definition of military service as referred to in the question.
FamilyMember,MILTPARNT,Family members who may be currently serving in the United States military.
MilitaryService,MILTPARNT,Current service status of family members in the United States military.
FamilyMember,MILTCHLDR,"Family members of the respondent, including spouse, unmarried partner, mother, father, son(s), daughter(s), brother(s), sister(s)."
MilitaryService,MILTCHLDR,Serving in the United States military.
FamilyMember,MILTSIBLN,"A family member of the respondent. Valid types include spouse, unmarried partner, mother, father, son, daughter, brother, or sister, whether biological, step, or adoptive."
MilitaryService,MILTSIBLN,Indicates whether the family member is currently serving in the United States military.
CollegeEnrollment,ENRLCOLLFT2,Enrollment status of family members in college full-time.
FamilyMember,ENRLCOLLFT2,"Family members including spouse, unmarried partner, mother, father, son, daughter, brother, and sister."
MilitaryService,ENRLCOLLFT2,Military service status of family members.
FamilyMemberSpouse,ENRLCOLLST2,The spouse of the respondent.
FamilyMemberUnmarriedPartner,ENRLCOLLST2,The unmarried partner of the respondent.
FamilyMemberMother,ENRLCOLLST2,The mother of the respondent.
FamilyMemberFather,ENRLCOLLST2,The father of the respondent.
FamilyMemberSon,ENRLCOLLST2,The son or sons of the respondent.
FamilyMemberDaughter,ENRLCOLLST2,The daughter or daughters of the respondent.
FamilyMemberBrother,ENRLCOLLST2,The brother or brothers of the respondent.
FamilyMemberSister,ENRLCOLLST2,The sister or sisters of the respondent.
MilitaryService,ENRLCOLLST2,Family members serving in the United States military.
WorkSituation,WRKSTATWK2,Recode of the respondent’s work situation in the past week.
Worked35MoreHoursPastWeek,WRK35WKUS,Indicates whether the respondent worked 35 hours or more in the past week.
WorkedLastWeek,WRKDPSTWK,Indicates whether the respondent worked during the past week.
WorkedPastYear,WRKDPSTYR,Indicates whether the respondent worked at any time in the past year.
MadeEffortToFindWork,WRKEFFORT,Indicates whether the respondent made an effort to find work if not employed.
ReasonForJob,WRKRSNJOB,Indicates the reason for having a job.
ReasonForNotWorking,WRKRSNNOT,Indicates the reason for not working.
WorkStatus,WRKDPSTWK,Work status of the respondent during the past week.
Respondent,WRKDPSTWK,Individual who is responding to the survey.
SurveyPeriod,WRKDPSTWK,"Week beginning on Sunday, [STARTDATE] and ending on Saturday, [ENDDATE]."
EmploymentStatus,WRKHADJOB,"The employment or business ownership status of the respondent, even if they did not work last week."
Respondent,WRKHADJOB,The individual responding to the survey.
WorkHoursLastWeek,WRKDHRSWK2,The number of hours worked in the last week at all jobs or businesses.
Employment,WRKDHRSWK2,The employment status and work activity of the respondent in the last week.
WorkHours,WRK35WKUS,The number of hours an individual usually works per week at all jobs or businesses.
EmploymentStatus,WRK35WKUS,The employment status of the respondent based on their working hours.
Respondent,WRK35WKUS,"The civilian, noninstitutionalized population aged 12 or older in the United States who responds to the survey."
ReasonForNotWorking,WRKRSNNOT,Reason for not working at the job in the past week.
TimePeriod,WRKRSNNOT,Past week.
ReasonForNotWorking,,The reason why the respondent did not have a job or business in the past week.
EmploymentStatus,,The employment status of the respondent in the past week.
Respondent,,An individual who is answering the survey.
EffortToFindWork,WRKEFFORT,Effort made to find work in the past 30 days.
JobContacts,WRKEFFORT,Contacts made with anyone about a job.
ResumeSent,WRKEFFORT,Resumes or job applications sent out.
AdsInteraction,WRKEFFORT,Placement or answering of job ads.
SurveyPeriod,WRKEFFORT,Past 30 days.
WorkSearchExclusion,WRKEFFORT,Reading job ads is not included.
Employment,WRKDPSTYR,Employment status of the respondent in the past 12 months.
SurveyPeriod,WRKDPSTYR,"The time period under consideration, which is the past 12 months."
Respondent,WRKDPSTYR,The individual answering the survey.
Job,WRKDPSTYR,A place where a respondent might have worked.
EmploymentStatus,WRKSELFEM,Indicator of self-employment status of the respondent in the past 12 months.
TimePeriod,WRKSELFEM,Time frame of the past 12 months.
EmployerCount,WRKNUMJOB2,Number of different employers the respondent had in the past 12 months.
EmploymentStatus,WRKNUMJOB2,Employment status of the respondent over the past 12 months.
TimePeriod,WRKNUMJOB2,The past 12 months period.
EmploymentStatus,WRKNJBPYR,"The employment status of the respondent during the past 12 months, focusing on periods without a job or business."
TimePeriod,WRKNJBPYR,A timeframe of 12 months during which the respondent's employment status is assessed.
Respondent,WRKNJBPYR,The individual responding to the survey.
Job,WRKNJBWKS,Representation of employment status or work engagement of the respondent.
WeeksWithoutJob,WRKNJBWKS,Number of weeks during the past 12 months when the respondent did not have at least one job or business.
SurveyPeriod,WRKNJBWKS,"The period over which the data is being collected, in this case, the past 12 months."
YearLastWorked,WRKLASTYR2,The year in which the respondent last worked at a job or business.
DaysMissedWork,WRKSICKMO,Number of whole days of work missed by the respondent due to sickness or injury in the past 30 days.
Respondent,WRKSICKMO,The individual who is answering the survey.
SicknessOrInjury,WRKSICKMO,"Conditions causing the respondent to miss work, including sickness or injury."
SurveyPeriod,WRKSICKMO,The specific time frame of the past 30 days referred to in the survey.
WorkStatus,WRKSICKMO,The employment status of the respondent impacted by sickness or injury.
WorkAbsenceDays,WRKSKIPMO,Number of whole days missed from work in the past 30 days because the respondent didn't want to be there.
SurveyPeriod,WRKSKIPMO,The past 30 days from the specified date to today.
PersonalChoiceAbsence,WRKSKIPMO,"Days missed from work due to personal choice, not including planned vacations or family sickness."
Workplace,WRKDRGPOL,The place where the respondent is employed.
WrittenPolicy,WRKDRGPOL,A formal document outlining rules and guidelines about employee use of alcohol or drugs.
DrugUse,WRKDRGPOL,Consumption of illegal drugs or misuse of prescription drugs.
AlcoholUse,WRKDRGPOL,Consumption of alcoholic beverages.
Policy,WRKDRGALB,A set of guidelines or rules established for a specific purpose.
Alcohol,WRKDRGALB,"An intoxicating substance consumed in various forms such as beer, wine, and spirits."
Drugs,WRKDRGALB,"Substances that can cause addiction, physical or psychological changes."
WorkplaceEducation,WRKDRGEDU,Educational information provided at the workplace regarding the use of alcohol or drugs.
Workplace,WRKDRGEDU,The respondent's place of employment.
Alcohol,WRKDRGEDU,A type of substance referred to in the educational information.
Drugs,WRKDRGEDU,Substances other than alcohol referred to in the educational information.
Education,WRKDRGEDU,The act of providing knowledge or information.
WorkplaceAssistanceProgram,WRKDRGHLP,Employee assistance program or other type of counseling program for employees with alcohol or drug-related problems offered through the workplace.
Workplace,WRKDRGHLP,The place where the respondent is employed.
Employee,WRKDRGHLP,An individual who is employed at a workplace.
AlcoholDrugRelatedProblems,WRKDRGHLP,Problems related to the use of alcohol or drugs.
Workplace,WRKTSTALC,The place of employment of the respondent.
Alcohol Usage Test,WRKTSTALC,Tests administered to employees to check for alcohol use.
Employee,WRKTSTALC,The respondent who is an employee.
Workplace,WRKTSTDRG,The place where an individual is employed.
DrugUseTest,WRKTSTDRG,A test administered to check for substances used by employees.
Employee,WRKTSTDRG,An individual who works for a workplace.
Workplace,WRKTSTHIR,The organization where the respondent is employed.
DrugTest,WRKTSTHIR,The test administered to detect drug use.
AlcoholTest,WRKTSTHIR,The test administered to detect alcohol use.
HiringProcess,WRKTSTHIR,The procedure followed by the workplace to hire new employees.
WorkplaceDrugTesting,WRKTSTRDM,Random drug or alcohol testing policy at the workplace
Workplace,WRKTSTRDM,The respondent's place of employment
Employee,WRKTSTRDM,An individual employed at a workplace
DrugUse,WRKTSTRDM,Use of drugs by employees
AlcoholUse,WRKTSTRDM,Use of alcohol by employees
