entity,question_code,description
Past Year Misuse,II2CRKRC,Timeline reference for assessing substance misuse.
Substance,IRHERRC,Heroin
Recency,IRHERRC,Recency of heroin use
Misuse,IRHERRC,Past year misuse of any Benzodiazepine Sedatives
Respondent,IRHERRC,Individual participating in the survey
SubstanceUse,,The past year misuse of Benzodiazepine Sedatives.
Respondent,,Person taking the survey
RecencyIndicator,,"Indicator for recency of heroin use, including past year misuse of Benzodiazepine Sedatives."
SurveyQuestion,,Question related to recency of heroin use and misuse of Benzodiazepine Sedatives.
HeroinRecency,II2HERRC,"The recency of heroin use, which includes detailed imputation indicator for past year misuse of any Benzodiazepines Sedatives."
BenzodiazepinesSedativesMisuse,II2HERRC,Indicator of any past year misuse of Benzodiazepine Sedatives.
OtherSedativesMisuse,II2HERRC,Indicator of any past year misuse of Sedatives specified as other Sedatives.
Drug,IRHALLUCREC,Any Benzodiazepines Sedatives
DrugType,IRHALLUCREC,Benzodiazepine Sedatives
DrugType,IRHALLUCREC,Other Sedatives
Misuse,IRHALLUCREC,Past year misuse
Respondent,IRHALLUCREC,Individual providing survey responses
Hallucinogen_Recency_Imputation_Indicator,IIHALLUCREC,Indicator for the imputation of recency of hallucinogen use.
Benzodiazepine_Sedatives_Misuse,IIHALLUCREC,Past year misuse of any Benzodiazepine Sedatives.
Respondent,IIHALLUCREC,Individual who responds to the survey.
LSD,IRLSDRC,"Lysergic acid diethylamide, a hallucinogenic drug."
Benzodiazepines,IRLSDRC,"A class of sedative drugs, often used to treat anxiety, insomnia, and other conditions."
Sedatives,IRLSDRC,A category of drugs designed to promote calm and relaxation or to induce sleep.
PastYearMisuse,IRLSDRC,The individual's misuse of substances during the past year.
LSD Recency,IILSDRC,Recency of LSD use for imputation purposes.
Benzodiazepine Sedatives,IILSDRC,Category of sedatives including benzodiazepines.
Past Year Misuse,IILSDRC,Denotes misuse within the past year.
Other Sedatives,IILSDRC,Sedatives specified other than benzodiazepine sedatives.
Imputation Indicator,IILSDRC,Indicator used for imputing data responses.
LSDRecency,,Detailed imputation indicator for past year misuse of any Benzodiazepines Sedatives.
BenzodiazepinesSedativesMisuse,,Indicates any past year misuse of Benzodiazepine Sedatives.
OtherSedatives,,A specific category of Sedatives that were specified as other Sedatives.
Respondent,,Individual providing responses for the NSDUH survey.
Benzodiazepine Sedatives,IRPCPRC,Benzodiazepine Sedatives misused by the respondent in the past year.
Misuse,IRPCPRC,The act of misusing Benzodiazepine Sedatives by the respondent.
Respondent,IRPCPRC,Individual taking part in the survey.
PastYearMisuse,IIPCPRC,Past year misuse of any Benzodiazepine Sedatives.
BenzodiazepineSedatives,IIPCPRC,Benzodiazepine Sedatives including those specified as other Sedatives.
ImputationIndicator,IIPCPRC,Indicator for the imputation of the past year misuse of Benzodiazepine Sedatives.
Benzodiazepine Sedatives,,"Any Benzodiazepines Sedatives, including specified other Sedatives, used in the past year."
Respondent,,Individual who participated in the NSDUH survey.
SubstanceUse,IRECSTMOREC,Past year misuse of any Benzodiazepines Sedatives.
DrugCategory,IRECSTMOREC,Benzodiazepine Sedatives.
TimePeriod,IRECSTMOREC,Past year.
Respondent,IRECSTMOREC,Individual providing survey data.
SubstanceMisuse,IIECSTMOREC,Past year misuse of Any Benzodiazepines Sedatives.
BenzodiazepineSedatives,IIECSTMOREC,Types of substances misused.
OtherSedatives,IIECSTMOREC,Other specified sedatives misused in the past year.
Ketamine Usage,IRKETMINREC,Recency of Ketamine usage
Past Year,IRKETMINREC,Time period referring to the past year
Benzodiazepine Sedatives,IRKETMINREC,Category of drugs including Benzodiazepine Sedatives
Other Sedatives,IRKETMINREC,Category of drugs specified as other sedatives
Respondent,IRKETMINREC,Person who answered the survey
KETAMINE_RECENCY_IMPUTATION_INDICATOR,IIKETMINREC,Imputation indicator for past year recency of ketamine use.
Any_Benzodiazepines_Sedatives_Misuse,IIKETMINREC,Misuse of any benzodiazepine sedatives in the past year.
Respondent,IIKETMINREC,The person who participated in the survey.
DrugUseRecency,IRDAMTFXREC,"Recency of DMT/AMT/Foxy misuse, including imputed values."
BenzodiazepineSedativeMisuse,IRDAMTFXREC,Misuse of Benzodiazepine Sedatives in the past year.
OtherSedativeMisuse,IRDAMTFXREC,Misuse of other specified Sedatives in the past year.
DrugUse,IIDAMTFXREC,Indicates the recency of misuse for any Benzodiazepine Sedatives.
BenzodiazepineSedatives,IIDAMTFXREC,Refers to a category of drugs that were misused in the past year.
Sedatives,IIDAMTFXREC,A broader category that includes Benzodiazepine Sedatives.
MisuseIndicator,IIDAMTFXREC,Indicator for past year misuse of specific drugs.
SubstanceUse,IRSALVIAREC,Indicates recency of misuse for Benzodiazepine Sedatives in the past year.
SubstanceType,IRSALVIAREC,Type of substance - Benzodiazepine Sedatives.
Respondent,IRSALVIAREC,Individual participating in the survey.
Survey,IRSALVIAREC,The NSDUH survey of 2022.
Substance,IISALVIAREC,Salvia
TimePeriod,IISALVIAREC,Past Year
Activity,IISALVIAREC,Misuse
ResponseType,IISALVIAREC,Positive Response
Respondent,IISALVIAREC,Survey respondent
SubstanceMisuse,IRINHALREC,Past year misuse of Any Benzodiazepines Sedatives.
BenzodiazepineSedatives,IRINHALREC,A type of sedative specified within the context of substance misuse.
OtherSedatives,IRINHALREC,Other types of sedatives specified within the context of substance misuse.
Respondent,IRINHALREC,The participant providing responses to the survey.
InhalantRecencyImputationIndicator,IIINHALREC,Imputation indicator for past year misuse of any benzodiazepine sedatives.
PastYearMisuse,IIINHALREC,Past year misuse of any benzodiazepine sedatives.
BenzodiazepineSedatives,IIINHALREC,Benzodiazepine sedatives specified as other sedatives.
OtherSedatives,IIINHALREC,Other sedatives that are included in the category of benzodiazepine sedatives.
Respondent,IIINHALREC,Individual who responded to the survey.
METHAMPHETAMINE_RECENCY,IRMETHAMREC,"The recency of methamphetamine use, with data imputed and revised."
PAST_YEAR_MISUSE,IRMETHAMREC,Indicates if there was any past year misuse of substances.
BENZODIAZEPINE_SEDATIVES,IRMETHAMREC,A type of sedative that was assessed for misuse in the past year.
OTHER_SEDATIVES,IRMETHAMREC,Sedatives other than benzodiazepines that were specified in the past year misuse assessment.
RESPONDENT,IRMETHAMREC,The individual participating in the survey.
MethamphetamineUseRecencyImputationIndicator,IIMETHAMREC,Indicates recency of methamphetamine use through imputation.
BenzodiazepinesSedativesMisuse,IIMETHAMREC,Past year misuse of any Benzodiazepines Sedatives.
Respondent,IIMETHAMREC,Individual responding to the survey.
Survey,IIMETHAMREC,NSDUH 2022 survey.
PastYear,IIMETHAMREC,Time period referring to the past year.
Pain_Reliever_Usage,IRPNRANYREC,Usage of any pain reliever based on imputation revision.
Prescription_Drug_Use,IRPNRANYREC,Any use of prescription drugs as directed by a doctor or misuse in any other way.
Misuse_of_Prescription_Drugs,IRPNRANYREC,Misuse of prescription drugs defined as use in any way not directed by a doctor.
Lifetime_Prescription_Drug_Use,IRPNRANYREC,Underreporting of lifetime prescription drug use.
IRTRQANYREC,IRTRQANYREC,Related variable indicating any use of a specific prescription drug.
IRSTMANYREC,IRSTMANYREC,Related variable indicating any use of a specific prescription drug.
IRSEDANYREC,IRSEDANYREC,Related variable indicating any use of a specific prescription drug.
AnyPainRelieverRecencyImputationIndicator,IIPNRANYREC,Record indicating the recency of any pain reliever use imputed from survey responses.
PrescriptionDrugUse,IIPNRANYREC,"Refers to any use of prescription drugs, either prescribed or misused."
MisuseOfPrescriptionDrugs,IIPNRANYREC,"Defined as use in any way not directed by a doctor, including without a prescription, using more or longer than told, or in any other way not directed."
ImputationIndicator,IIPNRANYREC,Flag to handle imputed values in survey responses.
PrescriptionDrugUse,IIOXCNANYYR,"Any use of prescription drugs, including misuse."
Doctor,IIOXCNANYYR,Healthcare professional who prescribes medication.
Misuse,IIOXCNANYYR,"Use of prescription drugs in any way not directed by a doctor, including use without a prescription, in greater amounts, more often, or for longer than prescribed."
RecencyIndicator,IIOXCNANYYR,Indicator of how recently prescription drugs were used.
FentanylUse,IRFENTANYYR,"Any past year use of fentanyl products, including own prescription use or misuse."
PrescriptionDrugUse,IRFENTANYYR,Any use of prescription drugs as directed by a doctor or misuse of such drugs.
PrescriptionDrugMisuse,IRFENTANYYR,"Use of prescription drugs in any way not directed by a doctor, including use without a prescription, in greater amounts, more often, or longer than prescribed."
OverreportingWarning,IRFENTANYYR,Caution against using responses indicating 'More than 12 months ago' and 'NEVER USED XXX' due to potential underreporting of lifetime prescription drug use.
PrescriptionDrugUse,IIFENTANYYR,Any past year use of fentanyl products.
PrescriptionDrug,IIFENTANYYR,Fentanyl products.
PrescriptionDrugUseType,IIFENTANYYR,Includes use of one's own prescription medication as directed by a doctor or the misuse of prescription drugs.
DrugMisuse,IIFENTANYYR,"Misuse of prescription drugs, including use without a prescription, use in greater amounts, more often, or longer than directed, or use in any other way not directed by a doctor."
TimePeriod,IIFENTANYYR,Past year.
PrescriptionDrugUse,IRTRQANYREC,"Use of prescription drugs, including both as directed by a doctor and misuse."
PrescriptionDrugMisuse,IRTRQANYREC,"Use of prescription drugs in any way not directed by a doctor, including without a prescription, in greater amounts, more often, longer, or any other ways not directed by a doctor."
Imputation,IRTRQANYREC,The process of imputing data for the variable concerning the recency of any tranquilizer use.
TimeFrame,IRTRQANYREC,"The period in which the use of prescription drugs was reported, specifically addressing concerns about underreporting of lifetime prescription drug use."
PrescriptionDrugs,IRTRQANYREC,"Any medications that are prescribed by a doctor, as reviewed in the context of this survey."
TranquilizersRecencyIndicator,IITRQANYREC,Imputation indicator for the recency of any tranquilizer use.
PrescriptionDrugUse,IITRQANYREC,"Any use of prescription drugs, defined as either the use of one's own prescription medication as directed by a doctor or the misuse of prescription drugs."
PrescriptionDrugMisuse,IITRQANYREC,"Misuse of prescription drugs, defined as using without one's own prescription, in greater amounts, more often, or longer than directed, or in any other way not directed by a doctor."
UnderreportingWarning,IITRQANYREC,Advisory note about potential underreporting of lifetime prescription drug use.
PrescriptionDrugUse,IRSTMANYREC,Any use of prescription drugs including both proper use and misuse.
StimulantsUseRecency,IRSTMANYREC,"The recency of any use of stimulants, including prescription and misuse."
MisuseOfPrescriptionDrugs,IRSTMANYREC,Use of prescription drugs in any way not directed by a doctor.
AnyStimulantsRecency,IISTMANYREC,"Indicator of recent usage of any stimulants, including prescription drugs used properly or misused."
PrescriptionDrugUse,IISTMANYREC,The use of one's own prescription medication as directed by a doctor.
MisuseOfPrescriptionDrugs,IISTMANYREC,"Use of prescription drugs in any way not directed by a doctor, including more frequent use, use in greater amounts, or use without a prescription."
TimePeriod,IISTMANYREC,"Time reference describing when prescription drugs were used (e.g., within the past 30 days, more than 12 months ago)."
PrescriptionDrugUse,IRSEDANYREC,"Any use or misuse of prescription drugs, specifically sedatives."
Misuse,IRSEDANYREC,Using prescription drugs in any way not directed by a doctor.
OwnPrescriptionMedicationUsage,IRSEDANYREC,Use of one's own prescription medication as directed by a doctor.
PrescriptionWithoutOwnMedication,IRSEDANYREC,Use of prescription drugs without a prescription of one's own medication.
ExcessiveUsage,IRSEDANYREC,"Use of prescription drugs in greater amounts, more often, or longer than directed."
PrescriptionDrugUse,,"Any use of one's own prescription medication as directed by a doctor or the misuse of prescription drugs, specifically for sedatives."
MisuseOfPrescriptionDrugs,,"Use of prescription drugs in any way not directed by a doctor, including without a prescription, in greater amounts, more often, or longer than told to take a drug."
Sedatives,,Type of prescription drug mentioned in the context of use and misuse.
Benzodiazepines,IRBZOANYYR,Any use of benzodiazepines in the past year including own prescription or misuse.
PrescriptionDrugs,IRBZOANYYR,Any use or misuse of prescription medication as directed by a doctor or not.
Misuse,IRBZOANYYR,Use of prescription drugs in any way not directed by a doctor.
TimePeriod,IRBZOANYYR,Past year use.
Benzodiazepines,IIBZOANYYR,"Any use of benzodiazepines in the past year, including both prescribed and misuse."
Prescription_Drugs,IIBZOANYYR,Drugs that require a prescription by a licensed healthcare provider.
Misuse,IIBZOANYYR,"Use of prescription drugs in any way not directed by a doctor, including use without one's own prescription, in greater amounts, more often, or longer than prescribed."
Past_Year_Use,IIBZOANYYR,Use of substances within the last twelve months.
Imputation_Indicator,IIBZOANYYR,Flags whether data has been imputed (estimated) due to missing or inconsistent responses.
PrescriptionDrugMisuse,IRPNRNMREC,"Misuse of prescription drugs is defined as use in any way not directed by a doctor, including use without a prescription of one's own medication; use in greater amounts, more often, or longer than told to take a drug; or use in any other way not directed by a doctor."
RecencyOfMisuse,IRPNRNMREC,The recency at which prescription drugs were misused.
PrescriptionDrugMisuse,IIPNRNMREC,"Misuse of prescription drugs, defined as use not directed by a doctor"
ImputationIndicator,IIPNRNMREC,Indicates whether data on the misuse of pain relievers has been imputed
PainReliever,IIPNRNMREC,Specific type of prescription drug whose misuse is being assessed
Recency,IIPNRNMREC,Time frame during which the misuse of pain reliever occurred
DataCaution,IIPNRNMREC,Cautionary note about potential underreporting of lifetime prescription drug use
PrescriptionDrugMisuse,IROXCNNMYR,Oxycontin misuse in the past year (imputed data).
Oxycontin,IROXCNNMYR,A specific prescription drug subject to misuse.
Misuse,IROXCNNMYR,Using prescription drugs in ways not directed by a doctor.
PrescriptionDrugMisuse,IIOXCNNMYR,"Misuse of prescription drugs including use without prescription, in greater amounts, more often or longer than prescribed."
OxyContin,IIOXCNNMYR,Specific type of prescription drug referred to in the question for past year misuse.
TimePeriod,IIOXCNNMYR,"Past year misuse, as referred to in the question."
PrescriptionDrugMisuse,IRFENTNMYR,"Misuse of prescription drugs, including using them without a prescription, in greater amounts, for longer durations, or in any way not directed by a doctor."
FentanylProducts,IRFENTNMYR,Misuse of fentanyl products in the past year.
TimePeriod,IRFENTNMYR,Past year
PrescriptionDrugMisuse,IIFENTNMYR,Misuse of fentanyl products in the past year.
FentanylProducts,IIFENTNMYR,Specific category of prescription drugs being misused.
Respondent,IIFENTNMYR,Individual who is answering the survey.
MisuseDefinition,IIFENTNMYR,"Use of prescription drugs in a way not directed by a doctor, including use without a prescription of one's own medication; use in greater amounts, more often, or longer than prescribed; or any other misuse."
PrescriptionDrugMisuse,IRTRQNMREC,Recency of tranquilizer misuse as per revised imputation.
Tranquilizer,IRTRQNMREC,Type of prescription drug involved in the misuse.
MisuseRecency,IRTRQNMREC,Measurement of how recently the tranquilizer was misused.
Imputation,IRTRQNMREC,Revised imputation method for determining tranquilizer misuse recency.
Prescription Drug Misuse,,"Use of prescription drugs in any way not directed by a doctor, including use without a prescription, use in greater amounts, more often, or longer than prescribed, or use in any other way not directed by a doctor."
Imputation Indicator,,Indicator variable for imputation of tranquilizer misuse recency.
Tranquilizer,,A type of prescription drug referenced in the context of misuse.
Recency of Misuse,,Time period since the last misuse of tranquilizers.
Substance Abuse,,Misuse of substances including prescription drugs like tranquilizers.
Potential Underreporting,,The caution about underreporting of lifetime prescription drug use in analysis.
Analysis Caution,,Advice against using certain levels ('More than 12 months ago' and 'NEVER MISUSED XXX') in analysis.
PrescriptionDrugMisuse,IRSTMNMREC,Recency of stimulant misuse through imputation revision.
PrescriptionDrugUse,IRSTMNMREC,Use of prescription drugs in any way not directed by a doctor.
MisuseCategory,IRSTMNMREC,"Categories of prescription drug misuse including use without a prescription, use in greater amounts, more often, or longer than told, or in any other way not directed by a doctor."
MisuseRecency,IRSTMNMREC,Timeframe of when the misuse of a prescription drug occurred.
PotentialUnderreportingNote,IRSTMNMREC,Caution about potential underreporting of lifetime prescription drug use for certain variables.
SurveyVariable,IRSTMNMREC,"Survey variable affected by potential underreporting; includes IRTRQNMREC, IRSTMNMREC, and IRSEDNMREC."
StimulantMisuseRecency,IISTMNMREC,Recency of stimulant misuse.
PrescriptionDrugsMisuse,IISTMNMREC,Misuse of prescription drugs is defined as use in any way not directed by a doctor.
Underreporting,IISTMNMREC,Users are cautioned against using certain levels due to potential underreporting of lifetime prescription drug use.
Sedative Misuse Recency,IRSEDNMREC,Revised imputation of the recency of sedative misuse.
Prescription Drug Misuse,IRSEDNMREC,"Misuse defined as use not directed by a doctor, including without a prescription, in greater amounts, or in any other way not prescribed."
Underreporting,IRSEDNMREC,Potential underreporting caution for 'More than 12 months ago' and 'NEVER MISUSED XXX' responses.
Misuse Recency,IRSEDNMREC,The recency of misuse of prescription drugs.
Respondent,IRSEDNMREC,Individual providing the response about sedative misuse.
SedativeMisuseRecency,IISEDNMREC,Recency of sedative misuse based on imputation.
PrescriptionDrugMisuse,IISEDNMREC,Misuse of prescription drugs defined as use not directed by a doctor.
MisusageTiming,IISEDNMREC,Has temporal categories like 'More than 12 months ago' and 'NEVER MISUSED'.
Substance,IRBZONMYR,Misuse of benzodiazepines in the past year.
PrescriptionDrugMisuse,IRBZONMYR,"Misuse of prescription drugs including use without a prescription, use in greater amounts, more often, or longer than directed, or any other misuse."
SurveyCaution,IRBZONMYR,Caution about underreporting regarding lifetime prescription drug use.
PrescriptionDrugMisuse,IIBZONMYR,Misuse of any benzodiazepines in the past year.
Benzodiazepines,IIBZONMYR,A class of psychoactive drugs whose misuse is being surveyed.
MisuseDefinition,IIBZONMYR,"Use not directed by a doctor including use without a prescription, use in greater amounts, more often, or longer than directed."
SurveyPeriod,IIBZONMYR,Past year.
CautionaryNote,IIBZONMYR,Users are cautioned against using 'More than 12 months ago' and 'NEVER MISUSED' in analysis due to potential underreporting.
AlcoholUseFrequency,IRALCFY,Frequency of alcohol use in the past year (12 months).
TimePeriod,IRALCFY,Relevant time period for assessing behavior or conditions.
Alcohol Frequency Past Year,IIALCFY,Frequency of alcohol consumption in the past year.
Imputation Indicator,IIALCFY,Indicator whether imputation is used for missing data on alcohol frequency in the past year.
Past Year Frequency,IIALCFY,"Frequency of a behavior (in this case, alcohol consumption) over the past 12 months."
AlcoholFrequency,II2ALCFY,Frequency of alcohol consumption in the past year
ImputationIndicator,II2ALCFY,Indicator for detailed imputation of alcohol frequency data
Respondent,II2ALCFY,Person providing data in the survey
SurveyPeriod,II2ALCFY,"Timeframe for the survey, in this case, the past year or 12 months"
MarijuanaUsage,IRMJFY,Frequency of marijuana usage in the past year
SurveyPeriod,IRMJFY,The past year or 12-month period
MarijuanaFrequencyPastYear,IIMJFY,Frequency of marijuana use in the past year or 12 months.
ImputationIndicator,IIMJFY,Indicator for whether the frequency of marijuana use in the past year was imputed.
MarijuanaUseFrequency,,Indicator for detailed imputation of Marijuana use frequency in the past year.
SurveyPeriod,,"Past Year Frequency, interchangeable with 12-Month Frequency."
Substance,IRCOCFY,Cocaine
Frequency,IRCOCFY,Past Year Frequency / 12-Month Frequency
Respondent,IRCOCFY,"Civilian, noninstitutionalized population aged 12 or older in the United States"
CocaineFrequencyImputationIndicator,IICOCFY,Indicates the imputation status for the frequency of cocaine use in the past year (also referred to as 12-month frequency).
Cocaine,,A stimulant drug extracted from the leaves of the coca plant.
Frequency,,The number of occurrences of a repeating event per unit of time.
UsageImputationIndicator,,Indicates whether the value of a variable related to substance usage was imputed (estimated).
SurveyPeriod,,The period of time for which the survey data is being referenced (12 months).
CocaineUseFrequency,II2COCFY,Frequency of cocaine use by the respondent in the past year (12-Month Frequency).
PastYear,II2COCFY,The time period representing the past 12 months.
DeatiledImputationIndicator,II2COCFY,Indication of detailed imputation for the frequency of cocaine use in the past year.
SubstanceUse,IRCRKFY,Crack cocaine usage frequency in the past year.
TimePeriod,IRCRKFY,The time span of the past year (12 months).
CrackFrequencyPastYear,IICRKFY,"Frequency of crack cocaine use in the past year, imputed."
ImputationIndicator,IICRKFY,Indicator for whether the response was imputed.
SurveyPeriod,IICRKFY,The time period of the past year or 12 months.
CrackFrequencyImputationIndicator,II2CRKFY,Indicator for the detailed imputation of crack cocaine use frequency in the past year.
PastYearFrequency,II2CRKFY,Frequency of a certain behavior or substance use identified in the past 12 months.
HeroinUse,IRHERFY,Frequency of heroin use in the past year (12 months).
SurveyPeriod,IRHERFY,"Past year frequency, interchangeable with 12-Month Frequency."
Substance,IIHERFY,Refers to heroin use frequency in the past year.
Frequency,IIHERFY,Interchangeable with the term '12-Month Frequency'.
Imputation,IIHERFY,Indicates the imputation status of heroin use frequency data in the past year.
SubstanceUse,II2HERFY,Indicates the detailed imputation indicator for the frequency of heroin use in the past year.
TimePeriod,II2HERFY,"The time frame over which the heroin use frequency is measured, specifically the past year or 12 months."
Hallucination,IRHALLUCYFQ,Evaluation of hallucination frequency in the past year or 12 months.
Frequency,IRHALLUCYFQ,Number of times an event (hallucination) occurred over a specified period.
TimePeriod,IRHALLUCYFQ,The specified period (Past Year or 12-Month) over which the frequency is measured.
Imputation Indicator,IIHALLUCYFQ,Indicator for the imputation of hallucinogen use frequency over the past year.
Hallucinogen Use Frequency,IIHALLUCYFQ,Frequency of hallucinogen use in the past year.
Time Period,IIHALLUCYFQ,"The reference period for substance use, also referred to as '12-Month Frequency' or 'Past Year Frequency'."
InhalantFrequencyPastYear,IRINHALYFQ,Frequency of inhalant use in the past 12 months
SubstanceUse,IRINHALYFQ,Usage of inhalants as a type of substance use
TimePeriod,IRINHALYFQ,Refers to the past 12 months
InhalantFrequencyPastYear,IIINHALYFQ,Indicates the frequency of inhalant use in the past year.
ImputationIndicator,IIINHALYFQ,Indicates whether the data value for inhalant frequency in the past year has been imputed.
SurveyPeriod,IIINHALYFQ,"The period over which the survey questions inquire (here, 12-Month Frequency or Past Year Frequency)."
SubstanceUseFrequency,IRMETHAMYFQ,Frequency of methamphetamine use in the past year.
Substance,IRMETHAMYFQ,Methamphetamine
Timeframe,IRMETHAMYFQ,Past year or 12-month period
SurveyTerm,IRMETHAMYFQ,Interchangeability of 'Past Year Frequency' and '12-Month Frequency'
METH_FREQUENCY_PAST_YEAR,IIMETHAMYFQ,Frequency of methamphetamine use in the past year or 12-month period.
IMPUTATION_INDICATOR,IIMETHAMYFQ,Indicator for imputed data regarding the frequency of methamphetamine use in the past year.
Survey,IIMETHAMYFQ,The survey from which the data is collected.
SurveyPeriod,IIMETHAMYFQ,The time period (past year or 12 months) relevant to the survey question.
CigaretteUse,IRCIGFM,Frequency of cigarette use in the past month (30 days).
TimePeriod,IRCIGFM,"The time period referred to in the question, specifically the past month (30 days)."
CigaretteImputationIndicator,IICIGFM,Indicator for imputed value of cigarette frequency in the past month.
SurveyPeriod,IICIGFM,"The time period of the past 30 days, also referred to as 'Past Month Frequency' or '30-Day Frequency'."
CigaretteUseFrequency,II2CIGFM,Detailed imputation indicator of cigarette use frequency in the past month.
PastMonth,II2CIGFM,The time period referring to the past 30 days.
