entity,question_code,description
YouthActivity,RLGFRND,"An activity participated in by youth, categorized into school-based, community-based, church or faith-based, or other activities."
ParticipationLevel,RLGFRND,"The level of participation in youth activities, categorized as 'Two or more activities' or 'None or one activity'."
ChurchOrFaithBasedActivity,RLGFRND,Participation in activities that are church or faith-based.
CommunityBasedActivity,RLGFRND,Participation in activities that are community-based.
YouthSuicideIdeation,YUSUITHKYR,Information related to youth seriously thinking about killing themselves in the past year.
MentalHealth,YUSUITHKYR,General category involving mental health issues.
Respondent,YUSUITHKYR,The individual providing responses to the survey.
YouthSuicidalIdeation,YUCOSUITHK2,Youth suicidal ideation due to COVID-19 pandemic in the past year.
COVID-19Impact,YUCOSUITHK2,Impact of the COVID-19 pandemic on mental health.
Youth,YUCOSUITHK2,Respondent aged 12 or older.
SuicidalThoughts,YUCOSUITHK2,Serious thoughts about killing oneself.
YouthSuicidePlans,YUSUIPLNYR,Indicates whether the youth made plans to kill themselves in the past year.
YouthSuicideIdeationScreen,YUSUIPLNYR,Screening tool used to gather information on youth suicidal ideation.
Youth,YUCOSUIPLN2,"Refers to the civilian, noninstitutionalized population aged 12 or older."
SuicidalIdeation,YUCOSUIPLN2,Refers to the thoughts or plans about committing suicide.
COVID-19,YUCOSUIPLN2,Coronavirus disease (COVID-19) pandemic situation affecting the population.
PastYear,YUCOSUIPLN2,Timeframe referring to the past 12 months.
MentalHealthStatus,DSTNRV30,The frequency of feeling nervous in the past 30 days.
Respondent,DSTNRV30,The interviewee or participant in the survey.
SurveyPeriod,DSTNRV30,The time frame of the last 30 days during which feelings are reported.
Survey,DSTNRV30,The NSDUH survey being conducted.
Hopelessness,DSTHOP30,Frequency of feeling hopeless over the past 30 days.
TimePeriod,DSTHOP30,The past 30 days.
MentalHealth,DSTHOP30,General category for mental health-related questions.
RestlessnessOrFidgety,DSTRST30,Frequency of feeling restless or fidgety in the past 30 days.
Respondent,DSTRST30,Person answering the survey.
TimePeriod,DSTRST30,The past 30 days.
EmotionalState,DSTCHR30,Sadness or depression experienced by the respondent.
Frequency,DSTCHR30,How often the emotional state is experienced.
TimePeriod,DSTCHR30,The time frame during which the emotional state is assessed (past 30 days).
Respondent,DSTCHR30,The individual providing the survey information.
EmotionalState,DSTEFF30,Feeling that everything is an effort.
TimePeriod,DSTEFF30,Past 30 days.
EmotionalState,DSTNGD30,"The state of feeling down, no good, or worthless."
TimePeriod,DSTNGD30,"The time period during which the emotional state is queried, specifically the past 30 days."
Frequency,DSTNGD30,"The frequency of occurrences of feeling down, no good, or worthless."
Feeling,DSTWORST,"Describes the respondent's emotional state such as depression, anxiety, or emotional stress."
TimePeriod,DSTWORST,Describes the time frame of the past 12 months and the past 30 days.
Respondent,DSTWORST,The individual responding to the survey.
EmotionState,DSTNRV12,The state of feeling nervous.
WorstMonth,DSTNRV12,"One month in the past 12 months when the respondent was the most depressed, anxious, or emotionally stressed."
Frequency,DSTNRV12,The frequency of feeling nervous during the worst month.
Emotional State,,"Describes the emotional state, specifically the feeling of hopelessness, experienced by the respondent."
Frequency,,Indicates how often the emotional state (feeling hopeless) was experienced in the worst emotional month.
Worst Emotional Month,,Refers to the month when the respondent felt emotionally at their worst.
EmotionalState,DSTRST12,Worst emotional month
FrequencyOfRestlessness,DSTRST12,Frequency of feeling restless or fidgety
Respondent,DSTRST12,Person answering the survey
EmotionalState,DSTCHR12,State of feeling sad or depressed during the worst emotional month.
Frequency,DSTCHR12,Frequency of feeling so sad or depressed that nothing could cheer you up.
SurveyRespondent,DSTCHR12,Individual responding to the survey.
WorstMonth,DSTCHR12,The month when the respondent was at their worst emotionally.
Emotion,DSTEFF12,The emotional state of feeling that everything was an effort.
TimePeriod,DSTEFF12,The period when the respondent was at their worst emotionally.
Frequency,DSTEFF12,How often the respondent felt that everything was an effort.
EmotionalState,DSTNGD12,"Frequency of feeling down on oneself, no good, or worthless."
WorstMonth,DSTNGD12,The specific month when the respondent felt at their worst emotionally.
MentalHealthInterference,IMPREMEM,Mental health interference with daily activities.
DifficultyRemembering,IMPREMEM,Difficulty remembering to do necessary things.
TimePeriodOneMonth,IMPREMEM,One month period in the past 12 months when interference was most severe.
MentalHealthInterference,IMPCONCN,"During that one month when your emotions, nerves or mental health interfered most with your daily activities."
DifficultyConcentrating,IMPCONCN,Difficulty concentrating on doing something important when other things were going on around.
DailyActivities,IMPCONCN,Daily activities of the respondent.
Emotion,IMPGOUT,"Emotions, nerves, or mental health status of the respondent in the past 12 months."
DailyActivities,IMPGOUT,Daily activities of the respondent.
Difficulty,IMPGOUT,Difficulty experienced by the respondent in going out of the house and getting around on their own.
TimePeriod,IMPGOUT,One month period in the past 12 months when mental health interfered most.
Emotional_Problems,IMPGOUTM,"Problems with emotions, nerves, or mental health."
House_Leaving_Ability,IMPGOUTM,Ability or inability to leave the house on their own.
Respondent,IMPGOUTM,Individual who is reporting.
EmotionInterference,IMPPEOP,"When emotions, nerves, or mental health interfere with daily activities."
DifficultyDealingWithStrangers,IMPPEOP,Difficulty experienced when dealing with people not known well.
SurveyPeriod,IMPPEOP,One month in the past 12 months.
Emotional_Problems,IMPPEOPM,"Problems related to emotions, nerves, or mental health."
Interactions_With_Strangers,IMPPEOPM,Dealing with people you did not know well.
Mental_Health,IMPPEOPM,Overall mental health condition of the respondent.
Respondent,IMPPEOPM,Individual answering the survey question.
MentalHealthInterference,IMPSOC,"Interference of emotions, nerves, or mental health with daily activities."
SocialActivitiesDifficulty,IMPSOC,Difficulty participating in social activities like visiting friends or going to parties.
SurveyRespondent,IMPSOC,An individual taking the NSDUH survey.
SurveyPeriod,IMPSOC,The one month when mental health had the most interference.
Emotion,IMPSOCM,"Problems with emotions, nerves, or mental health affecting social participation"
MentalHealth,IMPSOCM,Mental health problems
SocialActivity,IMPSOCM,Participation in social activities
EmotionalDifficulty,IMPHHLD,"Difficulty due to emotions, nerves, or mental health issues."
HouseholdResponsibilities,IMPHHLD,Tasks and duties related to managing a household.
TimePeriod,IMPHHLD,One month during the past 12 months.
EmotionalProblems,IMPHHLDM,"Problems with emotions, nerves, or mental health."
HouseholdResponsibilities,IMPHHLDM,Tasks related to managing and maintaining a household.
Respondent,IMPHHLDM,Individual who answers the survey.
MentalHealthInterference,IMPRESP,"Interference of emotions, nerves, or mental health with daily activities in the past 12 months."
WorkDifficulty,IMPRESP,Difficulty in taking care of work-related responsibilities.
SchoolDifficulty,IMPRESP,Difficulty in taking care of school-related responsibilities.
SurveyPeriod,IMPRESP,One month period in the past 12 months when mental health interfered most with daily activities.
Question,IMPRESPM,"Did problems with your emotions, nerves, or mental health keep you from working or going to school?"
EmotionalProblems,IMPRESPM,"Problems with emotions, nerves, or mental health."
Activity,IMPRESPM,Engagement in work or school activities.
Question,IMPWORK,Difficulty doing daily work in one month over the past 12 months.
Respondent,,"A civilian, noninstitutionalized individual aged 12 or older in the United States."
Mental_Health_Issue,,"Emotions, nerves, or mental health problems interfering with daily activities."
Daily_Activities,,Basic tasks and responsibilities respondents typically engage in.
Difficulty_Level,,The extent to which mental health issues disrupted daily work.
DifficultiesDuration,IMPWEEKS,Number of weeks having difficulties due to mental health in the past 12 months.
MentalHealth,IMPWEEKS,"Emotions, nerves, or mental health issues."
Respondent,IMPWEEKS,Person participating in the survey.
Survey,IMPWEEKS,NSDUH survey.
DifficultiesFrequency,IMPDYFRQ,Frequency of difficulties experienced in a week.
Week,IMPDYFRQ,Unit of time used to measure how often difficulties occur.
Respondent,IMPDYFRQ,Individual answering the survey questions.
DaysUnableToWork,IMPYDAYS,"Number of days in the past year the respondent was unable to work or carry out normal activities due to emotions, nerves, or mental health issues."
EmotionalHealth,IMPYDAYS,"The emotional, nerve-related, or mental health condition affecting the respondent."
PastYear,IMPYDAYS,The reference time period of the past 12 months.
Respondent,IMPYDAYS,Individual providing answers to the survey questions.
SuicidalThought,SUICTHNK,Serious thoughts about killing oneself in the past 12 months.
TimePeriod,SUICTHNK,"The past 12 months, from [DATEFILL] up to and including today."
SuicideAttemptConsideration,SUICTHNK,Consideration of attempting suicide in the past 12 months.
Respondent,SUICTHNK,Individual providing the response about suicidal thoughts.
MentalHealth,COSUITHNK,Adult's mental health status concerning thoughts about killing themselves due to COVID-19.
COVID-19,COSUITHNK,The global pandemic and its impact.
SuicidalThoughts,COSUITHNK,Consideration or contemplation of taking one's own life.
MentalHealth,SUIPLANYR,Planning to kill oneself during the past 12 months
SurveyRespondent,SUIPLANYR,"Civilian, noninstitutionalized population aged 12 or older in the United States."
SurveyPeriod,SUIPLANYR,Past 12 months
Adult,COSUIPLNYR,An individual aged 18 or older.
PlanToKillYourself,COSUIPLNYR,The intention or plan to commit suicide.
COVID-19,COSUIPLNYR,The global pandemic caused by the coronavirus SARS-CoV-2.
PsychologicalDistressScore,KSSLR6MONED,A score ranging from 0 to 24 indicating the level of psychological distress over the past 30 days.
SymptomsOfPsychologicalDistress,KSSLR6MONED,"The symptoms of psychological distress measured by K6 questions including feeling nervous (DSTNRV30), feeling hopeless (DSTHOP30), feeling restless or fidgety (DSTRST30), feeling so sad or depressed that nothing could cheer you up (DSTCHR30), feeling that everything was an effort (DSTEFF30), and feeling down on yourself, no good, or worthless (DSTNGD30)."
FrequentFeelingNervous,DSTNRV30,"Frequency of feeling nervous in the past 30 days, one of the symptoms measured by K6."
FrequentFeelingHopeless,DSTHOP30,"Frequency of feeling hopeless in the past 30 days, one of the symptoms measured by K6."
FrequentFeelingRestless,DSTRST30,"Frequency of feeling restless or fidgety in the past 30 days, one of the symptoms measured by K6."
FrequentFeelingCheerless,DSTCHR30,"Frequency of feeling so sad or depressed that nothing could cheer you up in the past 30 days, one of the symptoms measured by K6."
FrequentFeelingEffortful,DSTEFF30,"Frequency of feeling that everything was an effort in the past 30 days, one of the symptoms measured by K6."
FrequentFeelingWorthless,DSTNGD30,"Frequency of feeling down on yourself, no good, or worthless in the past 30 days, one of the symptoms measured by K6."
K6_Score,KSSLR6YRED,Score indicating the level of psychological distress during the worst month of the past year.
Psychological_Distress,KSSLR6YRED,"State of experiencing symptoms of depression, anxiety, or emotional stress."
Worst_Month,KSSLR6YRED,"The month in the past year when the respondent was more depressed, anxious, or emotionally stressed compared to the past 30 days."
Symptoms,KSSLR6YRED,"Collection of symptoms including nervousness, hopelessness, restlessness, sadness, effort, and feeling worthless."
DSTWORST,KSSLR6YRED,Variable indicating if there was a month in the past year when the respondent was more disturbed than the past 30 days.
DSTNRV12,KSSLR6YRED,Feeling nervous.
DSTHOP12,KSSLR6YRED,Feeling hopeless.
DSTRST12,KSSLR6YRED,Feeling restless or fidgety.
DSTCHR12,KSSLR6YRED,Feeling so sad or depressed that nothing could cheer them up.
DSTEFF12,KSSLR6YRED,Feeling that everything was an effort.
DSTNGD12,KSSLR6YRED,"Feeling down on themselves, no good, or worthless."
WHODAS_TOTAL_SCORE,WHODASSCED,"WHODAS total score ranging from 0 to 24, indicating level of impairment based on the difficulty in performing daily activities due to emotional, nerves, or mental health issues."
ActivityPerformance,WHODASSCED,"Evaluation of performance in daily activities including remembering tasks, concentration, getting out of the house, dealing with people, participating in social activities, household responsibilities, and work or school responsibilities."
DailyActivityDifficulty,WHODASSCED,"Levels of difficulty in performing daily activities: mild, moderate, and severe."
EmotionalImpact,WHODASSCED,"Impact of emotions, nerves, or mental health on the ability to perform daily activities."
WHODASDAED_SCORE,WHODASDAED,"Alternative WHODAS score ranging from 0 to 8, indicating level of impairment based on moderate or severe difficulty in performing daily activities due to emotional, nerves, or mental health issues."
AlternativeWHODASScore,WHODASDAED,A composite score derived from various impairment-related components in the WHODAS survey.
ImpairmentInConcentration,WHODASDAED,Difficulty in concentrating on tasks (IMPCONCN).
ImpairmentInGoingOut,WHODASDAED,"Difficulty in going out for short or long durations (IMPGOUT, IMPGOUTM)."
ImpairmentInHouseholdActivities,WHODASDAED,"Difficulty in performing household activities (IMPHHLD, IMPHHLDM)."
ImpairmentInDealingWithPeople,WHODASDAED,"Difficulty in interacting and communicating with other people (IMPPEOP, IMPPEOPM)."
ImpairmentInRemembering,WHODASDAED,Difficulty in remembering information (IMPREMEM).
ImpairmentInSocialParticipation,WHODASDAED,Difficulty in participating in social activities (IMPSOC).
EmotionalState,IRDSTNRV30,Frequency of feeling nervous in past 30 days - important for understanding mental health.
SurveyRespondent,IRDSTNRV30,"Individual answering the survey, contributing data on their emotional state."
SurveyPeriod,IRDSTNRV30,The last 30 days as the period over which the survey question applies.
Importance,IRDSTNRV30,Indicators of what the respondent considers important in their daily life impacting their mental health.
NervousnessFrequency,IIDSTNRV30,Frequency of feeling nervous in the past 30 days.
ImpactOnImportantAreas,IIDSTNRV30,"Impact of nervousness on important areas of life such as concentration, social activities, and household activities."
Feeling,IRDSTHOP30,Instances of feeling hopeless.
TimePeriod,IRDSTHOP30,Past 30 days.
MentalHealth,IRDSTHOP30,State of mental health related to feelings of hopelessness.
QuestionCategory,IRDSTHOP30,"The categories IMPCONCN, IMPGOUT, IMPGOUTM, IMPHHLD, IMPHHLDM, IMPPEOP, IMPPEOPM, IMPREMEM, IMPRESP, IMPRESPM, IMPSOC."
FeelingOfHopelessness,IIDSTHOP30,How often felt hopeless in the past 30 days.
Respondent,IIDSTHOP30,Individual who is responding to the survey.
Restlessness,IRDSTRST30,Frequency of feeling restless or fidgety in the past 30 days.
SurveyPeriod,IRDSTRST30,"The time period over which survey questions are asked, in this case, the past 30 days."
MentalHealthStatus,IRDSTRST30,"An individual's mental well-being, inferred from their frequency of feeling restless or fidgety."
FidgetyRestlessFeeling,IIDSTRST30,Frequency of feeling restless and fidgety in the past 30 days.
SurveyPeriod,IIDSTRST30,The time period in which the survey respondent evaluates their feelings or behaviors.
MoodStatus,IRDSTCHR30,Frequency of feeling unable to be cheered up in the past 30 days.
SurveyPeriod,IRDSTCHR30,30 days
ImpactOnFunctioning,IRDSTCHR30,"Various aspects impacting functioning like concentration, going out, household responsibilities, dealing with people, etc."
MentalHealth,IIDSTCHR30,Frequency of feeling unable to be cheered up in the past 30 days.
ImpConcn,,Impairment in concentration
ImpGout,,Impairment in going out
ImpGoutM,,Impairment in going out on most days
ImpHhld,,Impairment in household activities
ImpHhldM,,Impairment in household activities on most days
ImpPeop,,Impairment in interacting with people
ImpPeopM,,Impairment in interacting with people on most days
ImpRemem,,Impairment in remembering things
ImpResp,,Impairment in responding to situations
ImpRespM,,Impairment in responding to situations on most days
ImpSoc,,Impairment in social situations
MentalHealthEffortFrequency,IRDSTEFF30,Frequency of feeling that everything was an effort in the past 30 days.
SurveyPeriod,IRDSTEFF30,Time period of the past 30 days.
EffortFeelingFrequency,IIDSTEFF30,Frequency of feeling that everything was an effort in the past 30 days.
SurveyPeriod,IIDSTEFF30,Past 30 days.
MentalHealthImpact,IIDSTEFF30,Impact on mental health as indicated by feeling everything was an effort.
Respondent,IIDSTEFF30,Individual participating in the NSDUH survey.
MentalHealthState,,"This entity represents the frequency of feelings of being down, worthless, or no good in the past 30 days."
EmotionalState,,Impacts on concentration abilities.
SocialInteraction,,Impacts on the ability to go out with others.
HouseholdFunctioning,,Impacts on household responsibilities.
PerceptionByOthers,,Impacts on how others perceive the individual.
Memory,,Impacts on memory.
ResponseToPeople,,Impacts on responsiveness to others.
SocialEngagement,,Impacts on social activities and engagements.
FeelingDown,IIDSTNGD30,"Frequency of feeling down, worthless, or no good in the past 30 days."
MentalHealth,IIDSTNGD30,"Mental health status related to feelings of being down, worthless, or no good."
SurveyPeriod,IIDSTNGD30,The period of the past 30 days during which feelings are evaluated.
ImpactOnDailyLife,IIDSTNGD30,"The impact of feeling down on various aspects of daily life such as concentration, household responsibilities, social interactions, etc."
SurveyPeriod,,Period in the past 12 months during which respondents felt worse than in the past 30 days.
MentalHealth,,Mental health status during different periods of time.
ImpactOnDailyFunction,,Impact on concentration in daily activities.
ImpactOnSocialInteraction,,Impact on social interactions and relationships.
ImpactOnHouseholdActivity,,Impact on household activities.
ImpactOnWork,,Impact on work and responsibilities.
ImpactOnMemory,,Impact on memory and cognitive functions.
ImpactOnGroupActivities,,Impact on participation in group activities.
Identity,IIDSTWORST,Identification of the worst month in the past 12 months compared to the past 30 days.
MentalHealth,IIDSTWORST,Mental health status of the respondent over different periods.
SurveyPeriod,IIDSTWORST,"Survey period, specifically the past 30 days and the past 12 months."
ImpactIndicator,IIDSTWORST,"Indicators of mental health impact such as IMPCONCN (impact on concentration), IMPGOUT (going out), IMPHHLD (household tasks), IMPPEOP (social interactions), IMPRESP (responsibilities), and IMPSOC (social life)."
Feeling Nervous,IRDSTNRV12,Frequency of feeling nervous within the last month.
Impairment in Concentration,IRDSTNRV12,Impact of nervous feelings on ability to concentrate. (IMPCONCN)
Impairment in Going Out,IRDSTNRV12,"Impact of nervous feelings on ability to go out. (IMPGOUT, IMPGOUTM)"
Impairment in Household Duties,IRDSTNRV12,"Impact of nervous feelings on ability to perform household duties. (IMPHHLD, IMPHHLDM)"
Impairment in Interaction with People,IRDSTNRV12,"Impact of nervous feelings on interaction with people. (IMPPEOP, IMPPEOPM)"
Impairment in Remembering Things,IRDSTNRV12,Impact of nervous feelings on ability to remember things. (IMPREMEM)
Impairment in Responding to People,IRDSTNRV12,"Impact of nervous feelings on response to people. (IMPRESP, IMPRESPM)"
Impairment in Social Situations,IRDSTNRV12,Impact of nervous feelings on social situations. (IMPSOC)
FeelingNervous,IIDSTNRV12,Frequency of feeling nervous in the past month.
Respondent,IIDSTNRV12,The individual responding to the survey.
ImpactOnConcentration,IIDSTNRV12,Impact on the concentration ability of the respondent.
ImpactOnGoingOut,IIDSTNRV12,Impact on the social activities of the respondent.
ImpactOnGoingOutMore,IIDSTNRV12,Further impact on social activities beyond initial effects.
ImpactOnHouseholdTasks,IIDSTNRV12,Impact on the respondent's ability to manage household tasks.
ImpactOnHouseholdTasksMore,IIDSTNRV12,Further impact on household tasks beyond initial effects.
ImpactOnOtherPeople,IIDSTNRV12,Impact on the respondent's interaction with other people.
ImpactOnOtherPeopleMore,IIDSTNRV12,Further impact on interactions with other people beyond initial effects.
ImpactOnRememberingThings,IIDSTNRV12,Impact on the respondent's memory.
ImpactOnResponsibilities,IIDSTNRV12,Impact on the respondent's ability to manage responsibilities.
ImpactOnResponsibilitiesMore,IIDSTNRV12,Further impact on responsibilities beyond initial effects.
ImpactOnSocialLife,IIDSTNRV12,Impact on the respondent's social life.
Hopelessness,IRDSTHOP12,Frequency of feelings of hopelessness in the worst month.
MentalHealth,IRDSTHOP12,Relates to mental health issues such as feelings of hopelessness.
SurveyRespondent,IRDSTHOP12,Respondent who answers the survey question.
Emotion,IIDSTHOP12,Feeling of hopelessness
TimePeriod,IIDSTHOP12,Past month
ImportanceIndicator,IIDSTHOP12,Impact of feeling hopeless
MentalHealth,IRDSTRST12,Frequency of feeling restless or fidgety in the past month.
SurveyPeriod,IRDSTRST12,"The time frame for the survey question, which is the past month."
BehavioralSymptoms,IRDSTRST12,Symptoms such as restlessness or fidgetiness.
FeelingRestlessOrFidgety,IIDSTRST12,Frequency of feeling restless or fidgety in the past month
ImpactOnConcentration,IIDSTRST12,Impact on the ability to concentrate
ImpactOnGoingOut,IIDSTRST12,Impact on the ability to go out and engage in activities
ImpactOnHouseholdActivities,IIDSTRST12,Impact on household activities
ImpactOnInteractionsWithPeople,IIDSTRST12,Impact on interactions with other people
ImpactOnRememberingThings,IIDSTRST12,Impact on ability to remember things
ImpactOnWork,IIDSTRST12,Impact on work or productivity
ImpactOnSocialFunctioning,IIDSTRST12,Impact on social functioning
EmotionalState,IRDSTCHR12,Frequency of feeling unable to be cheered up in the past month.
SurveyPeriod,IRDSTCHR12,"Time frame related to the survey question, indicating the past month."
IIDSTCHR12,IIDSTCHR12,How often felt couldn't be cheered up in worst month - Importance Indicator.
Mental Health,IIDSTCHR12,Relates to the mental health experience of feeling down or unable to be cheered up.
Emotional Well-being,IIDSTCHR12,"Evaluation of emotional well-being, particularly concerning episodes of extreme sadness."
Feeling of Exhaustion,IRDSTEFF12,Frequency of feeling that everything is an effort in the past month.
IMPCONCN,IRDSTEFF12,Impacts concentration due to feeling everything is an effort.
IMPGOUT,IRDSTEFF12,Impacts going out and socializing due to feeling everything is an effort.
IMPGOUTM,IRDSTEFF12,Impacts going out and socializing with males due to feeling everything is an effort.
IMPHHLD,IRDSTEFF12,Impacts household responsibilities due to feeling everything is an effort.
IMPHHLDM,IRDSTEFF12,Impacts household responsibilities with males due to feeling everything is an effort.
IMPPEOP,IRDSTEFF12,Impacts interactions with people due to feeling everything is an effort.
IMPPEOPM,IRDSTEFF12,Impacts interactions with males due to feeling everything is an effort.
IMPREMEM,IRDSTEFF12,Impacts memory and remembering things due to feeling everything is an effort.
IMPRESP,IRDSTEFF12,Impacts responsibilities due to feeling everything is an effort.
IMPRESPM,IRDSTEFF12,Impacts responsibilities with males due to feeling everything is an effort.
IMPSOC,IRDSTEFF12,Impacts social life due to feeling everything is an effort.
FrequencyOfEffort,IIDSTEFF12,How often the respondent felt that everything was an effort in the past month.
MentalHealthStatus,IIDSTEFF12,Assessment of the respondent's mental health status based on survey responses.
Respondent,IIDSTEFF12,Individual providing responses to the survey questions.
TimePeriod,IIDSTEFF12,The past month
ImpactOnDailyLife,IIDSTEFF12,Effect of mental health on the daily activities of the respondent.
EmotionalState,IRDSTNGD12,"Frequency of feeling down, worthless, and no good in the past month"
MentalHealthImpact,IRDSTNGD12,"(IMPCONCN, IMPGOUT, IMPGOUTM, IMPHHLD, IMPHHLDM, IMPPEOP, IMPPEOPM, IMPREMEM, IMPRESP, IMPRESPM, IMPSOC)"
MentalHealthStatus,IIDSTNGD12,"Frequency of feeling down, worthless, or no good in the worst month."
MentalHealthImpact,IIDSTNGD12,"Impact level of negative mental health states (down, worthless, no good) on daily activities and overall well-being."
DifficultyRemembering,IRIMPREMEM,Difficulty remembering events or information in the past 12 months.
TimePeriod,IRIMPREMEM,Past 12 months.
MentalHealth,IRIMPREMEM,Indicates a potential mental health issue related to memory.
ImpConcentration,IRIMPREMEM,Impact on concentration and focus.
ImpSocialInteraction,IRIMPREMEM,Impact on social interactions.
ImpHouseholdActivities,IRIMPREMEM,Impact on household activities.
